{
  "schema_version": 1,
  "handoff_id": "20260729T001701-0300--COORDINATION-PHASE1--codex-to-gemini",
  "created_at": "2026-07-29T00:17:01-03:00",
  "task_id": "COORDINATION-PHASE1",
  "sender": "codex",
  "recipient": "gemini",
  "objective": "Adopt the canonical Phase 1 coordination protocol in every future repository task.",
  "context": [
    "The owner uses Claude, Codex, and Gemini concurrently and requested one standardized communication mechanism.",
    "ADR-0010 and DEC-048 establish .ai/state as the shared provider-neutral coordination surface.",
    "GATE-002 is open in indefinite standby and must not be resumed implicitly."
  ],
  "criteria": [
    "Read .ai/coordination/PROTOCOL.md before editing.",
    "Claim or receive exactly one task before editing its affected paths.",
    "Run the coordination validator and control-plane audit before completion."
  ],
  "constraints": [
    "Do not treat this handoff or private chat as architectural authority.",
    "Do not rewrite this immutable handoff file.",
    "Do not change protocol, registries, policies, hooks, permissions, skills, or MCPs without a separate owner-approved task."
  ],
  "uncertainties": [
    "File coordination is cooperative and does not provide an atomic distributed lock."
  ],
  "artifacts": [
    ".ai/coordination/PROTOCOL.md",
    ".ai/state/tasks/COORDINATION-PHASE1.json",
    "docs/adr/ADR-0010-multi-agent-coordination.md"
  ],
  "current_owner": "codex",
  "return_schema": "Acknowledge by following the protocol on the next claimed task; create a response handoff only if a conflict or missing rule is discovered.",
  "next_responsible_party": "gemini"
}
