{
  "schema_version": 1,
  "handoff_id": "20260729T135800Z--I-003B-TYPESCRIPT-PUBLIC-API-PILOT--codex-to-claude",
  "created_at": "2026-07-29T13:58:00Z",
  "task_id": "I-003B-TYPESCRIPT-PUBLIC-API-PILOT",
  "sender": "codex",
  "recipient": "claude",
  "objective": "Prevent concurrent writes to the two canonical planning files declared by I-003B before G-TOOLING started.",
  "context": [
    "I-003B was claimed by codex before G-TOOLING and declares CURRENT_PLANNING_STATE.md and GRAFTING_MASTER_SOURCE.md.",
    "G-TOOLING later declared the same two paths while both tasks are in progress.",
    "The remaining implementation paths are distinct and both tasks can continue safely."
  ],
  "criteria": [
    "Defer edits to CURRENT_PLANNING_STATE.md and GRAFTING_MASTER_SOURCE.md until I-003B completes or explicitly transfers those paths.",
    "Continue G-TOOLING work only on its non-overlapping paths.",
    "Re-read both task records before any later canonical planning edit."
  ],
  "constraints": [
    "Do not rewrite this immutable handoff.",
    "Do not overwrite or commit I-003B changes.",
    "Task records coordinate work but do not change architectural authority."
  ],
  "uncertainties": [
    "File coordination is cooperative; acknowledgement is visible only through a response handoff, task update, or released paths."
  ],
  "artifacts": [
    ".ai/state/tasks/I-003B-TYPESCRIPT-PUBLIC-API-PILOT.json",
    ".ai/state/tasks/G-TOOLING-REPO-MAP-AND-GENERATORS.json",
    ".ai/coordination/PROTOCOL.md"
  ],
  "current_owner": "codex",
  "return_schema": "Acknowledge by deferring the two overlapping files or create an immutable response handoff if coordination is required.",
  "next_responsible_party": "claude"
}
